username;date;retweets;favorites;text;geo;mentions;hashtags;id;permalink
dailypoliticaln;2017-08-11 23:45;0;0;"Allen Investment Management LLC Has $355,000 Stake in E.I. du Pont de Nemours and Company $ DD http:// ift.tt/2hRAsY6";;;;"896155692985229313";https://twitter.com/dailypoliticaln/status/896155692985229313
midetimes;2017-08-11 23:45;0;0;"Allen Investment Management LLC Has $355,000 Stake in E.I. du Pont de Nemours and Company $ DD http:// ift.tt/2wBYfhX";;;;"896155607555649537";https://twitter.com/midetimes/status/896155607555649537
storminvestor;2017-08-11 23:15;0;0;"Brown Advisory Securities LLC Acquires 1,965 Shares of E.I. du Pont de Nemours and Company $ DD http:// ift.tt/2uwFRts";;;;"896148137584214016";https://twitter.com/storminvestor/status/896148137584214016
SPNewsAnalysis;2017-08-11 23:15;0;0;"Brown Advisory Securities LLC Acquires 1,965 Shares of E.I. du Pont de Nemours and Company $ DD http:// ift.tt/2uO591F";;;;"896148116281229312";https://twitter.com/SPNewsAnalysis/status/896148116281229312
WatchlistN;2017-08-11 22:57;0;0;"Rothschild Investment Corp IL Reduces Stake in E.I. du Pont de Nemours and Company $ DD http:// ift.tt/2vYDsr2";;;;"896143524826980352";https://twitter.com/WatchlistN/status/896143524826980352
emq_news;2017-08-11 22:51;0;0;"E.I. du Pont de Nemours and Company $ DD Position Held by Investment House LLC http:// ift.tt/2hSxW3L";;;;"896142036058767360";https://twitter.com/emq_news/status/896142036058767360
IRAMarketReport;2017-08-11 22:02;0;0;"E.I. du Pont de Nemours and Company $ DD Shares Bought by Ipswich Investment Management Co. Inc. http:// ift.tt/2vqQtsA";;;;"896129648240730112";https://twitter.com/IRAMarketReport/status/896129648240730112
chaffeybreeze;2017-08-11 21:56;0;0;"E.I. du Pont de Nemours and Company $ DD Shares Bought by Ipswich Investment Management Co. Inc. http:// ift.tt/2vqQtsA";;;;"896128197217075201";https://twitter.com/chaffeybreeze/status/896128197217075201
HuntTrading41;2017-08-11 21:45;0;0;"$ EOS $ DD $ DFT If you day trade, this is a must have http:// bit.ly/2w3nVD2 pic.twitter.com/Fp78ywOcWP";;;;"896125407958716416";https://twitter.com/HuntTrading41/status/896125407958716416
androsForm;2017-08-11 18:59;25;20;"$ HON $ DD FTC Investigation dropped";;;;"896083552663617536";https://twitter.com/androsForm/status/896083552663617536
MarketCurrents;2017-08-11 18:19;0;0;"FTC closes investigation of Honeywell, DuPont agreements https:// seekingalpha.com/news/3288735-f tc-closes-investigation-honeywell-dupont-agreements?source=feed_f … $ HON $ DD";;;;"896073531909218304";https://twitter.com/MarketCurrents/status/896073531909218304
SweetPlatform;2017-08-11 18:13;0;0;"DD Top news - Aug 11th, 2017 $ DD http:// https:// goo.gl/VGw5dN";;;;"896071986631266304";https://twitter.com/SweetPlatform/status/896071986631266304
finzine;2017-08-11 17:56;0;0;"$ DD FTC says it closes investigation of Honeywell, Du Pont agreements https:// finance.yahoo.com/news/ftc-says- closes-investigation-honeywell-174033858.html …";;;;"896067708688646144";https://twitter.com/finzine/status/896067708688646144
newswithvalue;2017-08-11 17:52;0;0;"$ HON $ DD : FTC says it closes investigation of Honeywell, Du Pont agreements: http://www. StockNewsWires.com/hon-dd-ftc-say s-it-closes-investigation-of-honeywell-du-pont-agreements/ …";;;;"896066724277084162";https://twitter.com/newswithvalue/status/896066724277084162
TPCMG;2017-08-11 17:22;0;0;"$ DD : 4 open, suited signals indicate continued price decrease beyond average holding times. http:// thinkingprofit.com/equity/?s=DD";;;;"896059194230530050";https://twitter.com/TPCMG/status/896059194230530050
InvestParada;2017-08-11 17:17;0;0;"#FTC closes investigation of Honeywell $ HON & duPont $ DD";;;#FTC;"896058101031256064";https://twitter.com/InvestParada/status/896058101031256064
Margare30926081;2017-08-11 16:28;0;0;"Cypress Capital Management Boosted Dupont E I De Nemours & Co $ DD Position by $8.11 Million ...";;;;"896045755223244802";https://twitter.com/Margare30926081/status/896045755223244802
DozenStocks;2017-08-11 15:51;0;0;"S&P100 #Stocks Trend $ GD $ MSFT $ CAT $ FDX $ PCLN $ INTC $ UPS $ FOXA $ MRK $ CMCSA $ HAL $ DOW $ DD $ T $ EMR $ USB $ ALL @http:// 12Stocks.com/sp100";;@http;#Stocks;"896036251546992642";https://twitter.com/DozenStocks/status/896036251546992642
DozenStocks;2017-08-11 15:50;0;0;"Dow #Stocks Trend $ MSFT $ CAT $ INTC $ MRK $ DD $ BA $ CSCO $ AAPL $ IBM $ MCD $ JPM $ DIS $ UNH $ V $ HD $ TRV $ MMM $ AXP $ GS @http:// 12Stocks.com/dow";;@http;#Stocks;"896036118507864064";https://twitter.com/DozenStocks/status/896036118507864064
NewsToDesk;2017-08-11 15:16;0;0;"$ DD : DuPont To Acquire Granular For Farm Operations Software: http://www. StockNewsWires.com/dd-dupont-to-a cquire-granular-for-farm-operations-software/ …";;;;"896027442447474688";https://twitter.com/NewsToDesk/status/896027442447474688
positivebrands;2017-08-11 15:13;0;0;"DuPont To Acquire Granular For Farm Operations Software https:// seekingalpha.com/article/409799 3-dupont-acquire-granular-farm-operations-software?source=feed_f … $ DD";;;;"896026729122332672";https://twitter.com/positivebrands/status/896026729122332672
VentureDeal;2017-08-11 15:13;0;0;"DuPont To Acquire Granular For Farm Operations Software https:// seekingalpha.com/article/409799 3-dupont-acquire-granular-farm-operations-software?source=tweet … $ DD";;;;"896026696196829185";https://twitter.com/VentureDeal/status/896026696196829185
SEEKINGALPHA_FS;2017-08-11 15:11;0;0;"DuPont To Acquire Granular For Farm Operations Software https:// seekingalpha.com/article/409799 3-dupont-acquire-granular-farm-operations-software?source=twitter_sa_factset … $ DD";;;;"896026309146550272";https://twitter.com/SEEKINGALPHA_FS/status/896026309146550272
SeekingAlpha;2017-08-11 15:11;0;0;"DuPont To Acquire Granular For Farm Operations Software https:// seekingalpha.com/article/409799 3-dupont-acquire-granular-farm-operations-software?source=feed_f … $ DD";;;;"896026307229659137";https://twitter.com/SeekingAlpha/status/896026307229659137
dakotafinancial;2017-08-11 14:59;0;0;"Conestoga Capital Advisors LLC Has $293,000 Position in E.I. du Pont de Nemours and Company $ DD http:// ift.tt/2wALX9F";;;;"896023385351876608";https://twitter.com/dakotafinancial/status/896023385351876608
SPNewsAnalysis;2017-08-11 14:55;0;0;"Conestoga Capital Advisors LLC Maintains Stake in E.I. du Pont de Nemours and Company $ DD http:// ift.tt/2vpI20O";;;;"896022250557767680";https://twitter.com/SPNewsAnalysis/status/896022250557767680
IRAMarketReport;2017-08-11 14:55;0;0;"Guardian Investment Management Boosts Position in E.I. du Pont de Nemours and Company $ DD http:// ift.tt/2ux5RAQ";;;;"896022211647213568";https://twitter.com/IRAMarketReport/status/896022211647213568
chaffeybreeze;2017-08-11 14:51;0;0;"Guardian Investment Management Boosts Position in E.I. du Pont de Nemours and Company $ DD http:// ift.tt/2ux5RAQ";;;;"896021343803760640";https://twitter.com/chaffeybreeze/status/896021343803760640
storminvestor;2017-08-11 14:50;0;0;"Conestoga Capital Advisors LLC Maintains Stake in E.I. du Pont de Nemours and Company $ DD http:// ift.tt/2wOYkhK";;;;"896021089175961600";https://twitter.com/storminvestor/status/896021089175961600
noritsunagirota;2017-08-11 14:39;0;0;"Stonebridge Capital Advisors Has Upped Ei Du Pont De Nemours & Co $ DD Stake by $342,151 as Shares Rose ...";;;;"896018327532957696";https://twitter.com/noritsunagirota/status/896018327532957696
QuantchaIdeas;2017-08-11 14:27;0;0;"Price Target Alert: Trading the Zacks price target change for E.I DU PONT DE NEMOURS $ DD http:// ideas.quantcha.com/2017/08/11/pri ce-target-alert-trading-the-zacks-price-target-change-for-e-i-du-pont-de-nemours-dd-2/ … pic.twitter.com/bSUr4fFnVO";;;;"896015326500052992";https://twitter.com/QuantchaIdeas/status/896015326500052992
stocknewstimes;2017-08-11 13:56;0;0;"Bank of America Corp DE Cuts Stake in E.I. du Pont de Nemours and Company $ DD http:// ift.tt/2hQD5JL";;;;"896007358979223552";https://twitter.com/stocknewstimes/status/896007358979223552
SleekMoneycom;2017-08-11 13:48;0;0;"Bank of America Corp DE Cuts Stake in E.I. du Pont de Nemours and Company $ DD http:// ift.tt/2hQD5JL";;;;"896005376142749696";https://twitter.com/SleekMoneycom/status/896005376142749696
CRosberg8873;2017-08-11 13:46;0;0;"$ EGP $ ECC $ DD Seriously brilliant tool for traders, check it out http:// bit.ly/2v2Go5q pic.twitter.com/L32HnuSfP9";;;;"896004916128473088";https://twitter.com/CRosberg8873/status/896004916128473088
MarginHunt;2017-08-11 13:45;0;0;"The market is valuing Chemours $ CC at a premium vs peers. Sell? $ EMN $ AXTA $ HUN $ DD $ OLN http:// ow.ly/cGHR30eicpL pic.twitter.com/ZAzky2WRO3";;;;"896004573281779716";https://twitter.com/MarginHunt/status/896004573281779716
JLyonsFundMgmt;2017-08-11 13:24;0;1;"DuPont $ DD Testing Post-2016 Up Trendline #TrendlineWednesday pic.twitter.com/oddsO90y04";;;#TrendlineWednesday;"895999471267524609";https://twitter.com/JLyonsFundMgmt/status/895999471267524609
IRAMarketReport;2017-08-11 13:00;0;0;"E.I. du Pont de Nemours and Company $ DD Position Boosted by Two Sigma Securities LLC http:// ift.tt/2wAapb3";;;;"895993291040108544";https://twitter.com/IRAMarketReport/status/895993291040108544
chaffeybreeze;2017-08-11 12:56;0;0;"E.I. du Pont de Nemours and Company $ DD Position Boosted by Two Sigma Securities LLC http:// ift.tt/2wAapb3";;;;"895992266589851648";https://twitter.com/chaffeybreeze/status/895992266589851648
TheMartecGroup;2017-08-11 11:55;0;0;"#Ag Software Company Granular Acquired by DuPont http:// ow.ly/vvut30ejmFd $ DD pic.twitter.com/HqsX6FRagi";;;#Ag;"895976861116891138";https://twitter.com/TheMartecGroup/status/895976861116891138
TranscriptDaily;2017-08-11 11:10;0;0;"Logan Capital Management Inc. Continues to Hold Position in E.I. du Pont de Nemours and Company $ DD http:// ift.tt/2wA32k1";;;;"895965617832030208";https://twitter.com/TranscriptDaily/status/895965617832030208
noritsunagirota;2017-08-11 10:40;0;0;"Lucas Capital Management Has Trimmed By $494,283 Its E I Du Pont De Nemours & Co $ DD Holding ...";;;;"895957986593714176";https://twitter.com/noritsunagirota/status/895957986593714176
DozenStocks;2017-08-11 10:02;0;1;"Weekly S&P500 #Stocks Trend $ STX $ URI $ WYNN $ PHM $ RCL $ MU $ GLW $ SHW $ VRTX $ FLR $ DOW $ DD $ NSC $ KLAC $ ADI $ FDX @http:// 12Stocks.com/sp500";;@http;#Stocks;"895948521945186304";https://twitter.com/DozenStocks/status/895948521945186304
DozenStocks;2017-08-11 10:01;0;0;"Weekly S&P100 #Stocks Trend $ DOW $ DD $ FDX $ MSFT $ CAT $ FOXA $ GD $ PCLN $ CMCSA $ HAL $ INTC $ UPS $ MRK $ USB $ EMR @http:// 12Stocks.com/sp100";;@http;#Stocks;"895948253060972544";https://twitter.com/DozenStocks/status/895948253060972544
DozenStocks;2017-08-11 10:01;0;0;"Weekly S&P100 #Stocks Performance $ DOW $ DD $ FDX $ BA $ MSFT $ CAT $ TXN $ FOXA $ FB $ IBM $ JPM $ GD $ PCLN $ USB more@http:// 12Stocks.com/sp100";;@http;#Stocks;"895948187013267456";https://twitter.com/DozenStocks/status/895948187013267456
DozenStocks;2017-08-11 10:00;0;0;"Weekly Dow #Stocks Trend $ DD $ MSFT $ CAT $ INTC $ MRK $ BA $ CSCO $ AAPL $ IBM $ JPM $ MCD $ UNH $ DIS $ V $ HD $ TRV $ AXP @http:// 12Stocks.com/dow";;@http;#Stocks;"895948120260976640";https://twitter.com/DozenStocks/status/895948120260976640
WeekHerald;2017-08-11 08:22;0;0;"Grimes & Company Inc. Has $260,000 Position in E.I. du Pont de Nemours and Company $ DD http:// ift.tt/2vVAIuF";;;;"895923408709570560";https://twitter.com/WeekHerald/status/895923408709570560
WeekHerald;2017-08-11 08:22;0;0;"Headinvest LLC Has $249,000 Position in E.I. du Pont de Nemours and Company $ DD http:// ift.tt/2uwmhcM";;;;"895923404058087428";https://twitter.com/WeekHerald/status/895923404058087428
FinInvTr;2017-08-11 07:52;0;0;"The Commodity Cycle And Its Impact On Materials Firms https:// buff.ly/2vJxEC0 $ DOW $ DD $ MON $ PX $ ECL $ APD $ SHW $ PPG $ LYB $ IP $ NUE $ NEM pic.twitter.com/IHxfNmPrQR";;;;"895915696479252480";https://twitter.com/FinInvTr/status/895915696479252480
lynyisabelle;2017-08-11 07:21;0;0;"O problema não é a falta de alguém, mas as condições financeiras mesmo. hehe $ dd $ http:// www1.folha.uol.com.br/turismo/2017/0 8/1908461-mercado-para-quem-viaja-sozinho-ganha-servicos-especializados.shtml?cmpid=comptw …";;;;"895908019271344128";https://twitter.com/lynyisabelle/status/895908019271344128
Top_Dow_Stocks;2017-08-11 07:21;0;0;"#Dow #stocks $ DD E. I. Daily:-0.37% Weekly:6.39% YTD:5.86% Trend:100 / 100 http:// 12Stocks.com/DD";;;#Dow #stocks;"895907991890702337";https://twitter.com/Top_Dow_Stocks/status/895907991890702337
WeekHerald;2017-08-11 06:07;0;0;"Trust Co. of Toledo NA OH Has $2 Million Stake in E I Du Pont De Nemours And Co $ DD http:// ift.tt/2vUI5Do";;;;"895889425359552512";https://twitter.com/WeekHerald/status/895889425359552512
WeekHerald;2017-08-11 06:07;0;0;"E I Du Pont De Nemours And Co $ DD Stake Boosted by Private Advisor Group LLC http:// ift.tt/2wNLEI3";;;;"895889419906859008";https://twitter.com/WeekHerald/status/895889419906859008
dailypoliticaln;2017-08-11 03:58;0;0;"Guardian Investment Management Boosts Position in E.I. du Pont de Nemours and Company $ DD http:// ift.tt/2hQlJwJ";;;;"895856939929923584";https://twitter.com/dailypoliticaln/status/895856939929923584
dailypoliticaln;2017-08-11 02:33;0;0;"E.I. du Pont de Nemours and Company $ DD Shares Bought by Two Sigma Securities LLC http:// ift.tt/2vUt8jT";;;;"895835626309922820";https://twitter.com/dailypoliticaln/status/895835626309922820
midetimes;2017-08-11 02:31;0;0;"E.I. du Pont de Nemours and Company $ DD Shares Bought by Two Sigma Securities LLC http:// ift.tt/2wzuMFq";;;;"895835099715035139";https://twitter.com/midetimes/status/895835099715035139
wddeguzman;2017-08-11 02:09;19;18;"MSCI Review: PH Small Cap Index: Top weight increases: $ MWC , $ BLOOM , $ DD , $ DNL , $ VLL Top weight decrease: $ ABSP";;;;"895829435105984512";https://twitter.com/wddeguzman/status/895829435105984512