username;date;retweets;favorites;text;geo;mentions;hashtags;id;permalink
MarketsRecap;2016-12-12 23:39;0;0;"AMD Climbs After BMO Joins BofA In Getting More Bullish $ AMD Also $ INTC $ NVDA https:// goo.gl/zwfnra";;;;"808456166217043970";https://twitter.com/MarketsRecap/status/808456166217043970
computer_hware;2016-12-12 23:33;0;0;"Why #Intel ® CoFluent Technology for Big Data. Read Blog: http:// owler.us/abWLtZ $ INTC";;;#Intel;"808454712315953153";https://twitter.com/computer_hware/status/808454712315953153
computer_hware;2016-12-12 23:32;0;0;"Top Ten #Intel ® Software Developer Stories | December. Read Blog: http:// owler.us/abWLt8 $ INTC";;;#Intel;"808454557458055168";https://twitter.com/computer_hware/status/808454557458055168
computer_hware;2016-12-12 23:20;0;0;"SkyCross iMAT Technology Adopted for #Intel 's Home Gateway Platform. Read more: http:// owler.us/abWLmh $ INTC";;;#Intel;"808451451152318464";https://twitter.com/computer_hware/status/808451451152318464
AIREXmarket;2016-12-12 23:06;0;0;"#Intel , #TMobile , #Honeywell Make Barclays' Top Picks | $ INTC $ TMUS $ HON $ CAVM $ GE $ T $ VZ http:// bit.ly/2gEuS8I";;;#Intel #TMobile #Honeywell;"808448055494213632";https://twitter.com/AIREXmarket/status/808448055494213632
computer_hware;2016-12-12 22:54;0;0;"Qualcomm awakens and hopes to crush #Intel at its own game. Read more: http:// owler.us/abWLdl $ INTC";;;#Intel;"808444929508720641";https://twitter.com/computer_hware/status/808444929508720641
computer_hware;2016-12-12 22:46;0;0;"Nvidia is the new #Intel and its chips are used by most of the 3000 AI startups worldwide . Read more: http:// owler.us/abWLaN $ INTC";;;#Intel;"808442911029280771";https://twitter.com/computer_hware/status/808442911029280771
computer_hware;2016-12-12 22:44;0;0;"Sleeping giant Qualcomm awakens with aim to crush #Intel at its own game. Read more: http:// owler.us/abWK0X $ INTC";;;#Intel;"808442445172129793";https://twitter.com/computer_hware/status/808442445172129793
RaceDronePilot;2016-12-12 22:39;0;0;"We know the people over at Intel $ INTC are into #drones but it just might be the good folks at Apple $ AAPL are too. http://www. patentlyapple.com/patently-apple /2016/12/are-apple-and-samsung-racing-to-bring-a-drone-to-market-evidence-discovered-this-week-suggests-they-may-be.html …";;;#drones;"808441234129899521";https://twitter.com/RaceDronePilot/status/808441234129899521
jjjinvesting;2016-12-12 22:28;0;0;"Buy Intel Vs. AMD For The Next 12 Months http:// seekingalpha.com/article/402999 1-buy-intel-vs-amd-next-12-months?source=tweet … $ AMD $ WDC $ INTC";;;;"808438465251655680";https://twitter.com/jjjinvesting/status/808438465251655680
whotrades;2016-12-12 22:27;0;0;"Commented on StockTwits: sounds reasonable, thanks! What about their $ INTC partnership? http:// stocktwits.com/WhoTrades/mess age/69201820#69202574 …";;;#69202574;"808438184099147777";https://twitter.com/whotrades/status/808438184099147777
TweetsDelphync;2016-12-12 22:22;0;0;"Can Tim Cook's Meeting With Donald Trump Revitalize Apple? http:// seekingalpha.com/article/403001 4-can-tim-cooks-meeting-donald-trump-revitalize-apple?source=tweet … $ CSCO $ FB $ IBM $ INTC $ MSFT $ ORCL $ AAPL";;;;"808436961891401729";https://twitter.com/TweetsDelphync/status/808436961891401729
computer_hware;2016-12-12 22:22;0;0;"SkyCross iMAT Technology Adopted for #Intel 's Home Gateway Platform. Read more: http:// owler.us/abWK33 $ INTC";;;#Intel;"808436855897079808";https://twitter.com/computer_hware/status/808436855897079808
ConsumerFeed;2016-12-12 22:12;0;0;"Patriot Wealth Management Inc. Has $7,591,000 Position in Intel Corp. $ INTC http:// zpr.io/PfvbP";;;;"808434393375195137";https://twitter.com/ConsumerFeed/status/808434393375195137
whotrades;2016-12-12 22:08;0;0;"Do you want to buy more $ INTC ? We see more long positions opened here http:// bit.ly/121216INTC1 pic.twitter.com/ysoT2YpqB5";;;;"808433305007849472";https://twitter.com/whotrades/status/808433305007849472
realwillmeade;2016-12-12 22:06;0;1;"Unusual Call Option Activity for 12/12: $ BK $ MRK $ DXJ $ PAY $ OIH $ HPQ $ XLV $ SDRL $ XOM $ HAL $ JBLU $ T $ GE $ CHK $ XLU $ EBAY $ WFT $ PFE $ UNG $ INTC";;;;"808432867613282304";https://twitter.com/realwillmeade/status/808432867613282304
jmleray;2016-12-12 22:02;0;1;"Can Tim Cook's Meeting With Donald Trump Revitalize Apple? http:// seekingalpha.com/article/403001 4-can-tim-cooks-meeting-donald-trump-revitalize-apple?source=tweet … $ CSCO $ FB $ IBM $ INTC $ MSFT $ ORCL $ AAPL";;;;"808431753341890560";https://twitter.com/jmleray/status/808431753341890560
SAlphaTech;2016-12-12 22:01;0;1;"Can Tim Cook's Meeting With Donald Trump Revitalize Apple? http:// seekingalpha.com/article/403001 4-can-tim-cooks-meeting-donald-trump-revitalize-apple?source=twitter_salphatech … $ CSCO #CISCO $ FB $ IBM $ INTC $ MSFT $ ORCL $ AAPL";;;#CISCO;"808431677315760128";https://twitter.com/SAlphaTech/status/808431677315760128
SeekingAlpha;2016-12-12 22:01;0;1;"Can Tim Cook's Meeting With Donald Trump Revitalize Apple? http:// seekingalpha.com/article/403001 4-can-tim-cooks-meeting-donald-trump-revitalize-apple?source=feed_f … $ CSCO #CISCO $ FB $ IBM $ INTC $ MSFT $ ORCL $ AAPL";;;#CISCO;"808431675621273601";https://twitter.com/SeekingAlpha/status/808431675621273601
CFinancialNews;2016-12-12 21:54;0;0;"Intel Corp. $ INTC Position Raised by Patten & Patten Inc. TN http:// zpr.io/PfvmA";;;;"808429791594610688";https://twitter.com/CFinancialNews/status/808429791594610688
TPCMG;2016-12-12 21:46;0;0;"$ INTC : 3 open, suited signals indicate continued price increase for about 9 more days. http:// thinkingprofit.com/equity/?s=INTC";;;;"808427791972728835";https://twitter.com/TPCMG/status/808427791972728835
TheMidAgedCrazy;2016-12-12 21:24;0;0;"Buy Intel Vs. AMD For The Next 12 Months http:// seekingalpha.com/article/402999 1-buy-intel-vs-amd-next-12-months?source=tweet … $ AMD $ WDC $ INTC";;;;"808422323858509824";https://twitter.com/TheMidAgedCrazy/status/808422323858509824
computer_hware;2016-12-12 21:12;0;0;"#Intel 2-in-1 Apollo Lake tablets form Onda, Voyo, and Teclast. Read more: http:// owler.us/abWKJf $ INTC";;;#Intel;"808419309110210560";https://twitter.com/computer_hware/status/808419309110210560
computer_hware;2016-12-12 21:10;0;0;"Launch of #Intel 's Apollo Lake NUCs Gets Closer as Intel Lists Them on Web Site. Read more: http:// owler.us/abWKIs $ INTC";;;#Intel;"808418687971573760";https://twitter.com/computer_hware/status/808418687971573760
intercooleronli;2016-12-12 21:06;0;0;"Intel Corp. $ INTC Position Raised by Patten & Patten Inc. TN http:// zpr.io/PfvZu";;;;"808417809583652864";https://twitter.com/intercooleronli/status/808417809583652864
TradeWithSuper;2016-12-12 21:04;0;1;"Benzinga: What To Expect From The Trump Tech Summit http:// benzinga.com/z/8797871 $ AAPL $ AMZN $ FB $ MSFT $ GOOG $ TSLA $ ORCL $ INTC";;;;"808417292912656384";https://twitter.com/TradeWithSuper/status/808417292912656384
Benzinga;2016-12-12 21:00;1;2;"What To Expect From The Trump Tech Summit http:// benzinga.com/z/8797871 $ AAPL $ AMZN $ FB $ MSFT $ GOOG $ TSLA $ ORCL $ INTC";;;;"808416140636594181";https://twitter.com/Benzinga/status/808416140636594181
wlstcom;2016-12-12 20:57;0;0;"Why Broadcom Ltd Abandoned This Multi-Billion Dollar Opportunity -- The Motley Fool $ INTC http://www. fool.com/investing/2016 /12/12/why-broadcom-ltd-abandoned-this-multi-billion-doll.aspx … pic.twitter.com/1jt6aOG77X";;;;"808415580399267841";https://twitter.com/wlstcom/status/808415580399267841
finzine;2016-12-12 20:57;0;0;"$ INTC Why Broadcom Ltd Abandoned This Multi- Billion Dollar Opportunity http://www. fool.com/investing/2016 /12/12/why-broadcom-ltd-abandoned-this-multi-billion-doll.aspx …";;;;"808415574325915648";https://twitter.com/finzine/status/808415574325915648
bjk1903atl;2016-12-12 20:26;0;0;"Question to experience traders? Would you recommend indexes like $ SPY $ DIA $ IWM for IRA accounts or dividend stocks like $ KO $ T $ INTC $ MRK ?";;;;"808407592565403648";https://twitter.com/bjk1903atl/status/808407592565403648
NewsToDesk;2016-12-12 20:09;0;0;"$ WDC $ INTC $ AMD : Buy Intel Vs. AMD For The Next 12 Months: http://www. StockNewsWires.com/2016/12/12/wdc -intc-amd-buy-intel-vs-amd-for-the-next-12-months/ …";;;;"808403319165161472";https://twitter.com/NewsToDesk/status/808403319165161472
leahanneta;2016-12-12 20:08;0;0;"14:55 ET Volume Leader #34 - INTC 14,263,845 Intel Corp $ INTC 35.85 +0.09 +0.27% High today of 36.09 day low 3 http:// investorshangout.com/post/view?id=4 219992 …";;;#34;"808403084485476353";https://twitter.com/leahanneta/status/808403084485476353
SAlphaTech;2016-12-12 20:07;1;0;"Buy Intel Vs. AMD For The Next 12 Months http:// seekingalpha.com/article/402999 1-buy-intel-vs-amd-next-12-months?source=twitter_salphatech … $ AMD $ WDC $ INTC";;;;"808402968844210176";https://twitter.com/SAlphaTech/status/808402968844210176
SeekingAlpha;2016-12-12 20:07;1;1;"Buy Intel Vs. AMD For The Next 12 Months http:// seekingalpha.com/article/402999 1-buy-intel-vs-amd-next-12-months?source=feed_f … $ AMD $ WDC $ INTC";;;;"808402967229403136";https://twitter.com/SeekingAlpha/status/808402967229403136
jonogg;2016-12-12 20:00;0;0;"#investing $ MRK $ INTC $ GE $ JNJ are all very close runner-ups to joining the 2017 Dogs of the Dow preliminary list http:// 247wallst.com/investing/2016 /12/12/meet-the-preliminary-2017-dogs-of-the-dow-for-massive-dividends/ …";;;#investing;"808401200899100672";https://twitter.com/jonogg/status/808401200899100672
Oldie_Records;2016-12-12 19:15;1;0;"$ MU $ INTC #Micron warns #China could cause #Glut of #Memory #Chips - #NikkeiAsian Review via . @zerohedge http:// s.nikkei.com/2hlrH72";;@zerohedge;#Micron #China #Glut #Memory #Chips #NikkeiAsian;"808389941784965120";https://twitter.com/Oldie_Records/status/808389941784965120
TalkMarkets;2016-12-12 19:13;0;1;"The Next Billion Dollar Opportunity For #NVIDIA Corporation $ NVDA Also $ INTC $ MBLY https:// goo.gl/lJr2ew";;;#NVIDIA;"808389362513756162";https://twitter.com/TalkMarkets/status/808389362513756162
computer_hware;2016-12-12 19:01;0;0;"How AMD Seeks to Match #Intel and Nvidia in Machine Learning. Read more: http:// owler.us/abWJR3 $ INTC";;;#Intel;"808386231704817665";https://twitter.com/computer_hware/status/808386231704817665
computer_hware;2016-12-12 18:30;0;0;"#Intel Wants You to Know That Its All-In on Artificial Intelligence. Read more: http:// owler.us/abWJDk $ INTC";;;#Intel;"808378467326668800";https://twitter.com/computer_hware/status/808378467326668800
alexandriatech;2016-12-12 18:30;0;0;"Top #sentiment for #SP1500 #stocks at midday: $ INTC $ CSCO $ AMZN $ AAPL $ T (2016/12/12) #stocktrading #predictiveanalytics #bigdata";;;#sentiment #SP1500 #stocks #stocktrading #predictiveanalytics #bigdata;"808378391355396097";https://twitter.com/alexandriatech/status/808378391355396097
Alexability;2016-12-12 18:30;0;0;"Top sentiment for SP1500 stocks at midday: $ INTC $ CSCO $ AMZN $ AAPL $ T (2016/12/12) #sentiment #stock #alexandria";;;#sentiment #stock #alexandria;"808378389186879488";https://twitter.com/Alexability/status/808378389186879488
stockpulp;2016-12-12 18:28;1;0;"This is one of the most relevant articles about $ INTC now. The Biggest Players In Augmented Reality http:// benzinga.com/z/8793146 $ GOOG $ GOOGL";;;;"808378072487657476";https://twitter.com/stockpulp/status/808378072487657476
computer_hware;2016-12-12 18:28;0;0;"#Intel Wants You to Know That It's All-In on Artificial Intelligence. Read more: http:// owler.us/abWJCm $ INTC";;;#Intel;"808378000706125824";https://twitter.com/computer_hware/status/808378000706125824
alexandriatech;2016-12-12 18:00;0;0;"Top #sentiment for #SP1500 #stocks at midday: $ INTC $ CSCO $ AMZN $ T $ AXP (2016/12/12) #stocktrading #predictiveanalytics #bigdata";;;#sentiment #SP1500 #stocks #stocktrading #predictiveanalytics #bigdata;"808370844837773314";https://twitter.com/alexandriatech/status/808370844837773314
Alexability;2016-12-12 18:00;0;0;"Top sentiment for SP1500 stocks at midday: $ INTC $ CSCO $ AMZN $ T $ AXP (2016/12/12) #sentiment #stock #alexandria";;;#sentiment #stock #alexandria;"808370842652524544";https://twitter.com/Alexability/status/808370842652524544
JervisCapital;2016-12-12 17:44;0;0;"The Passive DGI Portfolio - Review http:// seekingalpha.com/article/402993 3-passive-dgi-portfolio-review?source=tweet … $ ABT $ ADP $ AFL $ APD $ CL $ CLX $ COP $ CSCO $ CVX $ DWX $ EMR $ HCP $ INTC $ JNJ $ LMT";;;;"808366885091868672";https://twitter.com/JervisCapital/status/808366885091868672
ELPfan;2016-12-12 17:41;0;1;"Microsoft Makes A Statement On The Future Of Mobile Computing... https:// seekingalpha.com/article/402992 0?source=ansh … $ MSFT , $ AAPL , $ INTC , $ QCOM";;;;"808366148928487424";https://twitter.com/ELPfan/status/808366148928487424
whotrades;2016-12-12 17:34;0;0;"Intel Wants You to Know That It’s All-In on Artificial Intelligence $ INTC http:// bit.ly/121216INTC";;;;"808364413661118464";https://twitter.com/whotrades/status/808364413661118464
TradeWithSuper;2016-12-12 17:32;0;0;"SAlphaTrending: Microsoft Makes A Statement On The Future Of Mobile Computing http:// seekingalpha.com/article/402992 0-microsoft-makes-statement-future-mobile-computing?source=feed_t … $ AAPL #APPLE $ INTC $ QCOM $ MSFT";;;#APPLE;"808363988602023938";https://twitter.com/TradeWithSuper/status/808363988602023938
SAlphaTrending;2016-12-12 17:30;0;1;"Microsoft Makes A Statement On The Future Of Mobile Computing http:// seekingalpha.com/article/402992 0-microsoft-makes-statement-future-mobile-computing?source=feed_t … $ AAPL #APPLE $ INTC $ QCOM $ MSFT";;;#APPLE;"808363303059587072";https://twitter.com/SAlphaTrending/status/808363303059587072
ProVesting;2016-12-12 17:25;0;0;"$ INTC : Intel Wants You to Know That It’s All-In on Artificial Intelligence: http://www. StockNewsWires.com/2016/12/12/int c-intel-wants-you-to-know-that-its-all-in-on-artificial-intelligence/ …";;;;"808362070567632896";https://twitter.com/ProVesting/status/808362070567632896
DynamicsMct;2016-12-12 17:22;0;0;"Microsoft Makes A Statement On The Future Of Mobile Computing http:// seekingalpha.com/article/402992 0-microsoft-makes-statement-future-mobile-computing?source=tweet … $ AAPL $ INTC $ QCOM $ MSFT";;;;"808361281904201728";https://twitter.com/DynamicsMct/status/808361281904201728
dermotski;2016-12-12 17:18;0;0;"Microsoft Makes A Statement On The Future Of Mobile Computing http:// seekingalpha.com/article/402992 0-microsoft-makes-statement-future-mobile-computing?source=tweet … $ AAPL $ INTC $ QCOM $ MSFT";;;;"808360489319329792";https://twitter.com/dermotski/status/808360489319329792
JorelLaraKalel;2016-12-12 17:14;0;0;"Microsoft Makes A Statement On The Future Of Mobile Computing $ MSFT $ QCOM $ INTC $ AAPL http:// bit.ly/2hmigBy http:// bit.ly/MSFTTTS";;;;"808359366952939521";https://twitter.com/JorelLaraKalel/status/808359366952939521
computer_hware;2016-12-12 17:13;0;0;"#Intel , T-Mobile, Honeywell Make Barclays' Top Picks. Read more: http:// owler.us/abWIZl $ INTC";;;#Intel;"808359043580313600";https://twitter.com/computer_hware/status/808359043580313600
TalkMarkets;2016-12-12 17:11;0;0;"#AMD Climbs After BMO Joins BofA In Getting More Bullish $ AMD Also $ INTC $ NVDA https:// goo.gl/zwfnra";;;#AMD;"808358525718188032";https://twitter.com/TalkMarkets/status/808358525718188032
stockpulp;2016-12-12 17:07;1;0;"This is one of the most relevant articles about $ MSFT now. Microsoft: Requiem For A Smartphone http:// seekingalpha.com/article/402786 3-microsoft-requiem-smartphone?source=tweet … $ HPQ $ INTC $ QCOM";;;;"808357568447991808";https://twitter.com/stockpulp/status/808357568447991808
newswelldone;2016-12-12 17:06;0;0;"$ TMUS $ ANET $ T $ VZ $ INTC : Intel, T-Mobile, Honeywell Make Barclays’ Top Picks: http://www. StockNewsWires.com/2016/12/12/tmu s-anet-t-vz-intc-intel-t-mobile-honeywell-make-barclays-top-picks/ …";;;;"808357258937692160";https://twitter.com/newswelldone/status/808357258937692160
SAlphaTech;2016-12-12 17:00;0;1;"Intel's Licensing Agreement With Nvidia Will Continue Well Beyond 2017 http:// seekingalpha.com/article/402960 8-intels-licensing-agreement-nvidia-will-continue-well-beyond-2017?source=feed_tags … $ AMD $ NVDA $ INTC";;;;"808355756512714753";https://twitter.com/SAlphaTech/status/808355756512714753
MarketChmln;2016-12-12 16:54;0;0;"$ INTC Is up 7 days in a row. Is this a sign of building momentum to the upside? #stockchart http:// tinyurl.com/j8jrgc2 pic.twitter.com/JO5lQucDdR";;;#stockchart;"808354436120805380";https://twitter.com/MarketChmln/status/808354436120805380
DozenStocks;2016-12-12 16:51;0;0;"Nasdaq100 #Stocks Performance $ REGN $ EA $ ISRG $ ATVI $ MAT $ SBAC $ CERN $ XRAY $ MDLZ $ INTC $ ADBE $ CA $ TSLA more@http:// 12Stocks.com/QQQQ";;@http;#Stocks;"808353577508868097";https://twitter.com/DozenStocks/status/808353577508868097
barronstechblog;2016-12-12 16:47;1;1;"The TAG Heuer Connected Smartwatch Needs to Reboot - Penta Daily - Barron's $ LVMH $ GOOGL $ INTC $ AAPL http:// blogs.barrons.com/penta/2016/12/ 10/the-tag-heuer-connected-smartwatch-needs-to-reboot/?mod=BOLBlog …";;;;"808352493516324865";https://twitter.com/barronstechblog/status/808352493516324865
SEEKINGALPHA_FS;2016-12-12 16:38;0;0;"The Passive DGI Portfolio - Review http:// seekingalpha.com/article/402993 3-passive-dgi-portfolio-review?source=twitter_sa_factset … $ ABT $ ADP $ AFL $ APD $ CL $ CLX $ COP $ CSCO $ CVX $ DWX $ EMR $ HCP $ INTC $ JNJ $ LMT";;;;"808350381499555841";https://twitter.com/SEEKINGALPHA_FS/status/808350381499555841
SeekingAlpha;2016-12-12 16:38;2;0;"The Passive DGI Portfolio - Review http:// seekingalpha.com/article/402993 3-passive-dgi-portfolio-review?source=feed_f … $ ABT $ ADP $ AFL $ APD $ CL $ CLX $ COP $ CSCO $ CVX $ DWX $ EMR $ HCP $ INTC $ JNJ $ LMT";;;;"808350379372986368";https://twitter.com/SeekingAlpha/status/808350379372986368
computer_hware;2016-12-12 16:32;0;0;"#Intel Pres.-elect Trump rejects intel, lawmakers vow probe of Russia hacking. Read more: http:// owler.us/abWIGJ $ INTC";;;#Intel;"808348793410228224";https://twitter.com/computer_hware/status/808348793410228224
intercooleronli;2016-12-12 16:29;0;0;"Intel Corp. $ INTC Receives Underweight Rating from Morgan Stanley http:// zpr.io/PfcS8";;;;"808348183202070528";https://twitter.com/intercooleronli/status/808348183202070528
finzine;2016-12-12 16:26;0;0;"$ INTC AMD Upgraded, Nvidia Gets Price-Target Hike, But Pacific Crest Cautious http://www. investors.com/news/technolog y/amd-upgraded-nvidia-gets-price-target-hike-but-pacific-crest-cautious/ …";;;;"808347235679399941";https://twitter.com/finzine/status/808347235679399941
computer_hware;2016-12-12 16:24;0;0;"#Intel Inside, on Geekbuying dozens of products in discount for Christmas. Read more: http:// owler.us/abWIA9 $ INTC";;;#Intel;"808346773462753280";https://twitter.com/computer_hware/status/808346773462753280
StockNewsWires;2016-12-12 16:21;0;0;"$ NVDA $ INTC $ AMD : AMD Upgraded, Nvidia Gets Price-Target Hike, But Pacific Crest Cautious: http://www. StockNewsWires.com/2016/12/12/nvd a-intc-amd-amd-upgraded-nvidia-gets-price-target-hike-but-pacific-crest-cautious/ …";;;;"808345963513442305";https://twitter.com/StockNewsWires/status/808345963513442305
TradeWithSuper;2016-12-12 16:16;0;0;"Benzinga: The Biggest Players In Augmented Reality https:// benzinga.com/z/8793146 $ GOOG $ INTC $ MSFT $ NVDA";;;;"808344712197369856";https://twitter.com/TradeWithSuper/status/808344712197369856
Benzinga;2016-12-12 16:15;0;1;"The Biggest Players In Augmented Reality https:// benzinga.com/z/8793146 $ GOOG $ INTC $ MSFT $ NVDA";;;;"808344413416132608";https://twitter.com/Benzinga/status/808344413416132608
jmleray;2016-12-12 16:14;0;0;"Microsoft Makes A Statement On The Future Of Mobile Computing http:// seekingalpha.com/article/402992 0-microsoft-makes-statement-future-mobile-computing?source=tweet … $ AAPL $ INTC $ QCOM $ MSFT";;;;"808344286194466816";https://twitter.com/jmleray/status/808344286194466816
SAlphaTech;2016-12-12 16:10;1;0;"Microsoft Makes A Statement On The Future Of Mobile Computing http:// seekingalpha.com/article/402992 0-microsoft-makes-statement-future-mobile-computing?source=twitter_salphatech … $ AAPL #APPLE $ INTC $ QCOM $ MSFT";;;#APPLE;"808343179233632258";https://twitter.com/SAlphaTech/status/808343179233632258
SeekingAlpha;2016-12-12 16:10;1;0;"Microsoft Makes A Statement On The Future Of Mobile Computing http:// seekingalpha.com/article/402992 0-microsoft-makes-statement-future-mobile-computing?source=feed_f … $ AAPL #APPLE $ INTC $ QCOM $ MSFT";;;#APPLE;"808343177480388608";https://twitter.com/SeekingAlpha/status/808343177480388608
WatchlistN;2016-12-12 16:08;0;0;"Nisa Investment Advisors LLC Sells 10,048 Shares of Intel Corp. $ INTC http:// zpr.io/PfcbE";;;;"808342847816663041";https://twitter.com/WatchlistN/status/808342847816663041
joseph_ippolito;2016-12-12 16:05;2;0;"A Look At How Intel Is About To Dominate The Drone Market http:// seekingalpha.com/article/401516 2-look-intel-dominate-drone-market?source=tweet … $ INTC";;;;"808341950621331456";https://twitter.com/joseph_ippolito/status/808341950621331456
WatchlistN;2016-12-12 16:04;0;0;"Vetr Inc. Lowers Intel Corp. $ INTC to Buy http:// zpr.io/PfcKA";;;;"808341701030973440";https://twitter.com/WatchlistN/status/808341701030973440
theflynews;2016-12-12 16:04;0;1;"AMD climbs after BMO joins BofA in getting more bullish $ AMD $ INTC $ NVDA http:// dlvr.it/MsbgSc";;;;"808341661688311808";https://twitter.com/theflynews/status/808341661688311808
Zolio1;2016-12-12 15:57;1;2;"Trump tech summit—all about H1Bs? Relief for the sector? $ AAPL $ GOOG $ MSFT $ AMZN $ ORCL $ CSCO $ IBM $ INTC $ QQQ";;;;"808339902022713344";https://twitter.com/Zolio1/status/808339902022713344
gilmoreport;2016-12-12 15:51;0;0;"$ INTC clearing its 50-day line...";;;;"808338508582486016";https://twitter.com/gilmoreport/status/808338508582486016
computer_hware;2016-12-12 15:49;0;0;"Women in technology: Advice from #Intel and Biogen. Read more: http:// owler.us/abWIc0 $ INTC";;;#Intel;"808337920285212672";https://twitter.com/computer_hware/status/808337920285212672
finzine;2016-12-12 15:36;0;0;"$ INTC Fed Will Raise Rates This Week: 4 Dividend Stocks to Buy That Should Do Fine http:// 247wallst.com/investing/2016 /12/12/fed-will-raise-rates-this-week-4-dividend-stocks-to-buy-that-should-do-fine/ …";;;;"808334605375967232";https://twitter.com/finzine/status/808334605375967232
amigobulls;2016-12-12 15:32;0;0;"How The CPU Market Will Change In 2017 $ AMD $ INTC http:// amigobulls.com/articles/amd-s tock-vs-intc-stock-better-2017-pick-advanced-micro-devices-inc-or-intel-corporation … pic.twitter.com/8epP5KH7Ai";;;;"808333779748220928";https://twitter.com/amigobulls/status/808333779748220928
HamLife86;2016-12-12 15:31;0;0;"Current holdings $ fnma $ pep $ ko $ mdlz $ dis options $ pep options $ csco $ ges $ bp $ qcomm $ intc and just purchase huge stack of $ nke last week";;;;"808333501271515136";https://twitter.com/HamLife86/status/808333501271515136
DavidGZeiler;2016-12-12 15:29;0;0;"Looking forward to the tweets from the #Trump meeting with #tech CEOs on Weds. http:// read.bi/2hd9ZCf via @sai $ AAPL $ MSFT $ INTC $ GOOG";;@sai;#Trump #tech;"808332985640488961";https://twitter.com/DavidGZeiler/status/808332985640488961
newswelldone;2016-12-12 15:29;0;0;"$ AMD $ INTC : Advanced Micro Devices: Then And Now: http://www. StockNewsWires.com/2016/12/12/amd -intc-advanced-micro-devices-then-and-now/ …";;;;"808332857324224512";https://twitter.com/newswelldone/status/808332857324224512
SAlphaTech;2016-12-12 15:27;0;0;"Advanced Micro Devices: Then And Now http:// seekingalpha.com/article/402989 9-advanced-micro-devices-now?source=twitter_salphatech … $ INTC #BRIANKRZANICH #INTEL $ AMD";;;#BRIANKRZANICH #INTEL;"808332355962171393";https://twitter.com/SAlphaTech/status/808332355962171393
SeekingAlpha;2016-12-12 15:27;0;0;"Advanced Micro Devices: Then And Now http:// seekingalpha.com/article/402989 9-advanced-micro-devices-now?source=feed_f … $ INTC #BRIANKRZANICH #INTEL $ AMD";;;#BRIANKRZANICH #INTEL;"808332354817179648";https://twitter.com/SeekingAlpha/status/808332354817179648
stephatkins;2016-12-12 15:13;2;1;"Wha?!? Trump to hold tech summit this week https:// seekingalpha.com/news/3229860?s ource=ansh … $ AAPL , $ GOOG , $ FB , $ AMZN , $ MSFT , $ CSCO , $ IBM , $ INTC , $ ORCL";;;;"808328929115246592";https://twitter.com/stephatkins/status/808328929115246592
jphelan17;2016-12-12 15:05;0;0;"$ INTC trying to get into the gap at $36.05";;;;"808326889702039553";https://twitter.com/jphelan17/status/808326889702039553
DividendSheet;2016-12-12 14:58;0;0;"Dogs Of The Dow Jones Dezember 2017 - https:// goo.gl/oPJKNV - $ INTC $ MMM $ MRK $ MSFT $ PFE $ PG $ TRV $ VZ $ UTX $ BA $ KO $ JNJ $ IBM $ GE";;;;"808325097761210369";https://twitter.com/DividendSheet/status/808325097761210369
computer_hware;2016-12-12 14:54;0;0;"AMD Stock vs Stock: Better 2017 Pick - Advanced Micro Devices Inc Or #Intel Corporation?. Read more: http:// owler.us/abWHWu $ INTC";;;#Intel;"808324099952939008";https://twitter.com/computer_hware/status/808324099952939008
asymmetricalpha;2016-12-12 14:53;0;0;"$ INTC Ready to fill that gap. Calls exploded http:// schrts.co/p4pVgA";;;;"808323934806544384";https://twitter.com/asymmetricalpha/status/808323934806544384
RadiHood;2016-12-12 14:53;0;0;"Well after some changes my portfolio looks like $ GES $ CTL $ RGR $ GME $ INTC $ JNJ $ SPY $ CGA in order of significance. maybe 2 #focused";;;#focused;"808323923360235520";https://twitter.com/RadiHood/status/808323923360235520
computer_hware;2016-12-12 14:46;0;0;"Can Qualcomm Take #Intel 's Share in the Data Center Market?. Read more: http:// owler.us/abWHSF $ INTC";;;#Intel;"808322235899342848";https://twitter.com/computer_hware/status/808322235899342848
