username;date;retweets;favorites;text;geo;mentions;hashtags;id;permalink
SleekMoneycom;2016-09-02 03:23;0;0;"Synovus Financial Corp Acquires 1,922 Shares of McDonald’s Corp. $ MCD http:// ift.tt/2cdMx37";;;;"771549044850044928";https://twitter.com/SleekMoneycom/status/771549044850044928
intercooleronli;2016-09-02 03:21;0;0;"Bingham Osborn & Scarborough LLC Sells 70 Shares of McDonald’s Corp. $ MCD http:// ift.tt/2bGO8Ts";;;;"771548538094227456";https://twitter.com/intercooleronli/status/771548538094227456
Sw1ng_Trader;2016-09-02 01:07;0;0;"http:// goo.gl/SyzlcL <<-- Checkout Super Trades service it is truly amazing!! $ CAPN $ KBIO $ CRM $ MCD";;;;"771514891299467264";https://twitter.com/Sw1ng_Trader/status/771514891299467264
StocksThatDoubl;2016-09-02 01:04;0;0;"PHENOMENAL stock trade alerts http:// BiloSelhi.com JOIN NOW Promo pic.twitter.com/e2zXG3II89 $ MCD $ COG $ EOG $ TSM $ ATVI $ LVS $ GPS $ SAN";;;;"771514005361942529";https://twitter.com/StocksThatDoubl/status/771514005361942529
TalkMarkets;2016-09-02 00:39;0;0;"Today's Trading Plan: Make Your Move, Market $ MCD $ SPXU $ SPY $ USO $ SPX $ VIX $ DJI http:// goo.gl/BU9Idl";;;;"771507706041602048";https://twitter.com/TalkMarkets/status/771507706041602048