username;date;retweets;favorites;text;geo;mentions;hashtags;id;permalink
ChartMill;2016-11-27 23:39;0;0;"$ UTX getting a lot of social media attention http:// stockcharts.chartmill.com/u/SklfjCyKGx #GIF #AnotherFollowTrain pic.twitter.com/NPqtc3nWZP";;;#GIF #AnotherFollowTrain;"803020361935753216";https://twitter.com/ChartMill/status/803020361935753216
StockNewsWires;2016-11-27 23:37;0;0;"$ UTX : Deal for Carrier to Keep US Plant Open May Hinge on Tax Overhaul: http://www. StockNewsWires.com/2016/11/27/utx -deal-for-carrier-to-keep-us-plant-open-may-hinge-on-tax-overhaul/ …";;;;"803019853414232064";https://twitter.com/StockNewsWires/status/803019853414232064
gem_2014;2016-11-27 21:22;0;0;"5 of 5 $ UNH $ UTX $ V $ VZ $ WMT $ XOM and install them on your computer, free for a month. Skype: gemsbot for info.... http:// fb.me/8hmhR2sAf";;;;"802985896282820608";https://twitter.com/gem_2014/status/802985896282820608
GemsBot;2016-11-27 21:22;0;0;"Commented on StockTwits: 5 of 5 $ UNH $ UTX $ V $ VZ $ WMT $ XOM and install them o... http:// stocktwits.com/GemsBot/messag e/67912580#67912596 … pic.twitter.com/DxN9MVhXB7";;;#67912596;"802985889232080896";https://twitter.com/GemsBot/status/802985889232080896
WKRBNews;2016-11-27 17:37;0;0;"Greystone Investment Management LLC Continues to Hold Position in United Technologies Corp. $ UTX http:// ift.tt/2fBM2jT";;;;"802929314656374784";https://twitter.com/WKRBNews/status/802929314656374784
intercooleronli;2016-11-27 17:27;0;0;"UMB Bank N A MO Has $4,547,000 Stake in United Technologies Corp. $ UTX http:// zpr.io/PRKDb";;;;"802926935940747264";https://twitter.com/intercooleronli/status/802926935940747264
WKRBNews;2016-11-27 17:25;0;0;"Greystone Investment Management LLC Continues to Hold Position in United Technologies Corp. $ UTX http:// zpr.io/PRKDg";;;;"802926425892265984";https://twitter.com/WKRBNews/status/802926425892265984
RudyHavenstein;2016-11-27 01:45;2;20;"BREAKING: Noted money manager and short-seller Bernie Sanders issues "Strong Sell" on United Technologies shares, with a $90 target. $ UTX";;;;"802689655720153088";https://twitter.com/RudyHavenstein/status/802689655720153088